        Cat,Maker,2015,2016,2017,2018,2019,2020,2021,2022,2023,2024
3W,"""VOLVO GROUP INDIA PVT LTD""",0,0,31,12,0,0,0,0,0,0
3W,3EV INDUSTRIES PVT LTD,0,0,0,0,0,0,112,390,545,51
2W,3GB TECHNOLOGY PVT LTD,0,0,0,1,0,0,0,0,0,0
3W,3GB TECHNOLOGY PVT LTD,0,1,1,0,0,0,0,0,0,0
3W,3S INDUSTRIES PRIVATE LIMITED,0,0,0,0,48,66,43,68,266,578
LMV,3S INDUSTRIES PRIVATE LIMITED,0,0,0,0,3,1,0,0,0,0
3W,A P I MOTORS PVT LTD,0,0,0,2,28,14,20,93,279,146
3W,A.V.AUTOMOTIVES PVT LTD,0,0,33,280,452,256,677,1451,1309,674
2W,A-1 SUREJA INDUSTRIES,0,0,0,0,0,0,0,0,0,2
3W,AADITYA EMOTORS INDIA PVT LTD,0,1,471,179,10,0,0,0,0,0
LMV,AADITYA EMOTORS INDIA PVT LTD,0,0,2,6,0,0,0,0,0,0
3W,AADITYA GARBAGE PRODUCTS PVT LTD,0,0,0,0,13,0,0,10,34,4
LMV,AADITYA GARBAGE PRODUCTS PVT LTD,0,0,0,0,1,0,0,0,0,0
3W,AAHANA COMMERCE PVT LTD,0,0,0,0,0,61,202,309,918,1194
3W,AAKK AUTO PVT LTD,0,0,0,0,0,0,0,0,0,16
3W,AASHI INDIA AUTOMOBILES PVT LTD,0,0,0,0,1,0,0,0,0,0
3W,ABHAVIS TECHNOLOGY (I) PVT LTD,0,0,1,0,0,0,0,0,0,0
2W,ABZO MOTORS PVT LTD,0,0,0,0,0,0,0,0,12,48
3W,ADAPT MOTORS PVT LTD,0,0,0,0,6,2,1,3,4,1
LMV,ADAPT MOTORS PVT LTD,0,0,0,0,0,0,0,0,0,1
3W,ADIDEV TECHNOA PVT LTD,0,0,0,0,8,14,34,168,689,927
3W,ADITYA AGRO INDUSTRIES,0,2,17,3,0,0,1,0,0,0
3W,ADITYA SAI INDUSTRIES,0,39,187,176,296,75,53,129,179,152
LMV,ADITYA SAI INDUSTRIES,0,0,2,2,0,0,0,0,0,0
2W,ADRIS ELECTRIC PVT LTD,0,0,0,0,0,0,65,226,61,8
2W,AFTEK MOTORS INDIA PVT LTD,0,0,0,0,0,1,8,186,138,34
3W,AGRAWAL RENEWABLE ENERGY PVT LTD,0,0,0,0,2,2,1,1,0,2
3W,AGRO INDUSTRIES,0,0,1,0,0,0,0,0,0,0
3W,AJAY MOTORS PRIVATE LIMITED,0,0,0,0,0,0,0,33,190,109
3W,AKASH AGRO INDUSTRIES,0,0,0,0,1,0,0,0,0,0
3W,AKSMD RECHARGEABLE VEHICLES PVT LTD,0,0,0,0,1,0,0,0,0,0
3W,ALBEDO VISION PVT LTD,0,0,0,15,6,15,0,14,39,4
3W,ALLENTTI MOTORS PVT LTD,0,0,0,0,0,0,0,0,59,131
3W,ALLFINE INDUSTRIES PVT LTD,0,2,239,763,1737,1180,2370,5884,10743,6317
LMV,ALLFINE INDUSTRIES PVT LTD,0,0,0,0,0,0,0,0,8,0
3W,ALTIER ELECTRIC VEHICLES PVT LTD,0,0,0,0,177,308,381,1626,2517,1804
LMV,ALTIER ELECTRIC VEHICLES PVT LTD,0,0,0,0,0,0,0,0,1,0
3W,ALTIGREEN PROPULSION LABS PVT LTD,0,0,0,0,0,3,144,699,2512,939
LMV,ALTIGREEN PROPULSION LABS PVT LTD,0,0,0,0,0,0,2,0,7,6
2W,ALTIUS EV TECH PVT LTD,0,0,0,0,0,0,0,67,37,14
3W,AMBIKA INDUSTRIES,0,0,0,0,427,656,981,1159,1910,1060
2W,AMO MOBILITY SOLUTIONS PVT LTD,0,0,0,0,0,0,0,1497,1574,80
2W,AMPERE VEHICLES PRIVATE LIMITED,0,0,0,0,1196,4522,12470,79857,42903,857
2W,AMPERE VEHICLES PVT LTD,31,0,0,0,6,153,315,2390,8,0
3W,AMPERE VEHICLES PVT LTD,0,0,44,0,0,0,0,0,0,0
3W,ANOOP CYLINDERS PVT LTD,0,0,0,0,0,0,0,0,0,8
3W,APARNA INDUSTRIES,0,10,93,182,190,83,96,86,87,30
3W,API MOTORS PVT LTD,0,0,5,0,0,0,0,0,0,0
3W,ARMAN GREEN VEHICLES PVT LTD,0,5,195,214,99,41,31,14,0,0
3W,ARNA ELECTRIC AUTO PVT LTD,0,0,29,331,308,185,373,344,590,76
3W,ASAV AUTOMOTIVE PVT LTD,0,0,0,0,0,0,0,0,0,1
3W,ASHLESHA POWER CONTROLS PVT LTD,0,0,0,0,0,0,0,0,6,2
3W,ASHMA-MOTORS PVT LTD,0,0,0,0,0,0,0,0,294,828
3W,ASTER AUTOMOTIVE PVT LTD,0,0,0,7,0,0,0,2,0,0
2W,ATHER ENERGY PVT LTD,0,0,0,24,2291,3052,15930,51808,104735,58547
3W,ATLAS COPCO INDIA LTD,0,0,0,2,0,0,0,0,0,0
2W,ATOMEX E-MOTORS INDIA PVT LTD,0,0,0,0,0,2,17,3,1,0
3W,ATR TECHNOSALES PRIVATE LIMITED,0,0,4,9,5,0,0,0,0,0
3W,ATTOLENT AUTO GROUP PVT LTD,0,397,1023,660,492,176,132,456,760,408
3W,ATTOLENT AUTOGROUP PVT LTD,35,1299,190,31,2,12,0,0,0,0
3W,ATUL GREENTECH PRIVATE LIMITED,0,0,0,0,0,0,0,0,127,308
2W,ATUMOBILE PVT LTD,0,0,0,0,0,0,0,0,105,22
3W,AUTOCROLA INDIA LTD,0,0,0,1,0,0,0,0,0,0
3W,AUTOECO GREEN ENERGY PVT LTD,0,0,0,0,0,0,0,21,578,524
3W,AUTOHAUS PRIVATE LIMITED,0,0,0,206,329,124,326,485,103,2
3W,AUTOLITE (INDIA) LIMITED,0,0,49,216,571,328,139,64,11,1
3W,AVL ELECTRIC VEHICLES PVT LTD,0,0,0,54,717,517,957,1480,2632,1951
LMV,AVL ELECTRIC VEHICLES PVT LTD,0,0,0,0,1,0,0,0,0,0
3W,AVON CYCLE LTD INDIA,0,1,17,4,1,3,13,40,10,0
3W,AXCEED INDUSTRIES (OPC) PVT LTD,0,0,0,0,6,0,0,0,0,0
2W,AYAAN ELECTRONIC PVT LTD,0,0,0,0,0,2,0,132,112,25
2W,BAILI MOTOR (IMPORTER:A B MOTOSS EV PVT LTD),0,0,0,0,0,0,0,0,4,3
3W,BAJAJ IMPLEMENTS PVT LTD,0,0,71,20,0,0,0,0,0,0
3W,BAL GOPAL WHEELS PVT LTD,0,0,21,87,94,31,86,64,105,99
LMV,BAL GOPAL WHEELS PVT LTD,0,0,0,0,1,0,0,0,0,0
3W,BALAN ENGINEERING PVT LTD,0,0,0,0,0,0,13,105,146,112
3W,BALI AUTO INDUSTRIES,0,2,155,295,315,178,237,333,274,159
2W,BATTRE ELECTRIC MOBLITY PVT LTD,0,0,0,0,0,0,0,516,4139,1836
2W,BENLING INDIA ENERGY AND TECHNOLOGY PVT LTD,0,0,0,0,0,567,4758,13130,3005,402
3W,BENTINCK INDUSTRIES PVT. LTD.,0,0,13,160,122,77,91,254,382,137
3W,BEST WAY AGENCIES PVT LTD,0,57,1501,2044,2312,2155,5022,6447,7902,3545
3W,BESTWAY AGENCIES PVT LTD,1,147,271,11,8,50,179,141,33,0
2W,BGAUSS AUTO PRIVATE LIMITED,0,0,0,0,0,0,0,1983,11454,10711
3W,BHAVE ELECTRIC VEHICLES PVT LTD,0,0,1,0,2,122,456,1591,2682,1398
3W,BHM INDUSTRIES,0,0,0,0,0,23,456,1028,1814,1377
3W,BIG BULL TRADER PVT LTD,0,0,30,426,565,460,227,307,673,1040
LMV,BIG BULL TRADER PVT LTD,0,0,0,0,0,0,0,0,0,1
2W,BLIX CYCLES AND E-VEHICLES PVT LTD,0,0,0,0,0,0,8,45,65,4
LMV,BMW INDIA PVT LTD,1,0,0,5,0,0,0,163,1309,591
2W,BOOMA INNOVATIVE TRANSPORT SULUTIONS PVT LTD,0,0,0,0,0,0,0,484,207,326
2W,BOUNCE ELECTRIC 1 PVT LTD,0,0,0,0,0,0,0,4514,3565,1598
3W,BRIGHT AUTOZONE PVT LTD,0,43,608,713,708,413,1708,3702,3695,1853
3W,BSERAIL ENGINEERING PVT LTD,0,0,0,0,0,0,0,0,0,41
3W,BULL MACHINES PVT LTD,0,0,21,3,0,0,0,0,0,0
LMV,BYD INDIA PRIVATE LIMITED,0,0,0,0,0,0,2,453,2012,1401
3W,CAPCO INDUSTRIES PVT LTD,0,0,0,0,0,0,0,0,0,30
LMV,CAPCO INDUSTRIES PVT LTD,0,0,0,0,0,0,0,0,0,1
3W,CARREE YUNUS VEHICLE PVT LTD,0,0,0,0,0,0,0,0,3,22
3W,CART INDIA,0,0,0,17,123,99,26,7,109,357
3W,CATERPILLAR INDIA PRIVATE LIMITED,0,0,5,0,0,0,0,0,0,0
3W,CEEON INDIA,0,311,536,928,687,263,213,394,874,394
3W,CENTURY MOTORS PVT LTD,0,2,2,0,0,0,0,0,0,0
3W,CHARUVIKRAM AUTOMOBILE PVT LTD,0,0,0,0,84,56,22,6,6,0
3W,CHATELEC VEHICLES INDIA LTD,0,0,1,0,0,0,0,0,0,0
LMV,CHATELEC VEHICLES INDIA LTD,0,0,1,1,0,0,0,0,0,0
3W,CHAUHAN AUTO INDUSTRIES,0,0,0,17,121,86,118,406,571,380
2W,CHETAK TECHNOLOGY LIMITED,0,0,0,0,0,0,0,0,4851,4
3W,CHEVROLET SALES INDIA PVT LTD,0,6,0,0,0,0,0,0,0,0
3W,CITADEL ENTERPRISES(OPC) PVT LTD,0,0,0,0,24,26,28,36,28,8
3W,CLAAS INDIA P LTD,0,0,0,1,0,0,0,0,0,0
3W,CLENERGY INNOVATIONS PVT LTD,0,0,0,0,0,0,0,0,0,1
3W,CLH GASEOUS FUEL APPL PVT LTD,4,157,158,37,11,5,0,0,0,0
LMV,CLH GASEOUS FUEL APPL PVT LTD,0,0,0,1,0,0,0,0,0,0
LMV,CNH INDUSTRIAL (INDIA) PVT LTD,0,1,1,0,0,0,0,0,0,0
3W,CONTINENTAL ENGINES PVT LTD,0,0,57,1,1,11,92,571,2749,425
LMV,CONTINENTAL ENGINES PVT LTD,0,0,0,0,0,0,0,2,0,0
3W,CYRUS AUTO INDUSTRIES PVT LTD,0,0,0,0,2,14,7,24,96,37
3W,D S INDUSTRIES,0,0,0,0,11,29,31,46,32,2
3W,D S R AUTOMOTIVES (INDIA) PVT LTD,0,0,3,0,0,0,0,0,0,0
3W,DAEWOO MOTORS INDIA LTD,0,0,2,0,0,0,0,0,0,0
3W,DAIMLER INDIA COMMERCIAL VEHICLES PVT. LTD,0,1,1,0,0,0,0,0,0,0
3W,DAKSH INDUSTRIES,0,0,0,0,0,30,1125,3225,5925,2871
2W,DAO EVTECH PRIVATE LIMITED,0,0,0,0,0,0,0,102,283,72
3W,DASHMESH MECH WORKS PVT LTD,0,1,3,0,0,0,0,0,0,0
3W,DAVE EXIM PVT LTD,0,0,567,854,1031,387,285,243,311,120
3W,DD AUTO PVT LTD,0,136,274,397,222,62,8,13,2,0
3W,DE EUSI MOTORS PVT LTD.,0,0,0,0,119,114,345,720,1563,1048
3W,DEEPTI SMART MOBILITY PVT LTD,0,0,0,0,1,0,0,0,0,0
3W,DELTEK ENTERPRISES PVT LTD,0,0,0,192,106,5,0,0,8,21
3W,DESMOTO ELECTRICS PVT LTD,0,0,0,0,0,16,30,1,0,0
3W,DEVAM ELECTRIC VEHICLES PVT LTD,0,0,0,4,0,0,0,0,12,83
3W,DHAR IN PVT LTD,0,0,0,0,0,0,0,0,29,26
3W,DILIGENT MOBILITY SERVICE PVT LTD,0,0,0,0,0,0,0,0,0,1
3W,DILIP CHHABRIA DESIGN PVT LTD,0,1,0,0,0,1,0,0,0,0
2W,DILLI ELECTRIC AUTO PVT LTD,0,0,0,0,0,0,0,2,0,0
3W,DILLI ELECTRIC AUTO PVT LTD,16,1573,2205,3404,3954,2541,5361,13987,25071,11832
LMV,DILLI ELECTRIC AUTO PVT LTD,0,2,1,7,2,0,1,2,5,0
MMV,DIVYA INDUSTRIES,1,0,0,0,0,0,0,0,0,0
3W,DIWA GREEN TECHNOLOGY PVT LTD,0,0,0,10,6,1,2,0,0,0
3W,DSF INDUSTRIES PVT LTD,0,0,5,22,72,132,17,14,26,1
2W,DSK MOTOWHEELS PVT LTD.,1,2,0,0,0,0,0,0,0,0
3W,DSR EV MOBILITY PVT LTD,0,0,0,0,0,0,0,0,3,27
3W,DUCATI INDIA PVT LTD,0,0,0,1,0,0,0,0,0,0
3W,DUKE AUTO INDIA,0,0,0,55,271,259,428,610,934,444
3W,DUKEMOTO MOTORS PVT LTD,0,0,0,0,11,9,0,0,0,0
3W,DURABLE FLANGES PVT LTD,0,0,0,1,7,17,0,0,0,0
2W,DURGA FILTERS PVT LTD,0,0,0,0,0,0,0,0,2,0
3W,DYNAVOLT TECHNOLOGY INDIA LTD,0,0,0,142,48,2,11,11,0,1
3W,DYS IMPEX PRIVATE LIMITED,0,27,777,473,1150,243,121,421,751,495
3W,DYS IMPEX PVT LTD,1,4,130,2,0,1,0,0,0,0
2W,E ROYCE MOTORS INDIA PVT LTD,0,0,0,0,0,0,0,0,5,0
3W,E ROYCE MOTORS INDIA PVT LTD,0,0,0,0,0,0,448,1381,1296,479
2W,E-ASHWA AUTOMOTIVE (HS 2W) PVT LTD,0,0,0,0,0,0,0,0,0,1
3W,E-ASHWA AUTOMOTIVE PVT LTD,0,0,0,0,3,23,74,129,240,86
2W,ECO FUEL SYSTEMS (I) PVT LTD,0,0,0,0,0,20,280,728,595,127
3W,ECO SMART VEHICLES PVT LTD,0,0,0,115,58,14,154,453,1245,816
3W,ECO-FRIENDLY ELECTRIC VEHICLE PVT LTD,0,0,18,61,147,53,9,29,1,165
3W,ECOYAN ELECTRIC MOTOR VEHICLES PVT LTD,0,0,0,0,7,8,8,4,7,0
3W,ECOYAN ELECTRIC MOTORS VEHICLE PVT LTD,0,0,0,0,2,0,0,0,0,0
3W,EEVEE ENGINEERING PVT LTD,0,0,0,11,13,5,14,20,1,0
3W,EFEV CHARGING SOLUTION PVT LTD,0,0,0,0,0,0,0,82,526,170
2W,EKO VEHICLE PRIVATE LIMITED,10,0,8,0,0,0,0,0,0,0
3W,EKO VEHICLE PRIVATE LIMITED,0,1,0,0,0,0,0,0,0,0
3W,ELECTROTECH TRANSMISSION PVT LTD,0,0,0,0,0,0,0,0,1,0
2W,ELECTROTHERM (INDIA) LIMITED,0,0,15,48,2,0,0,0,0,0
3W,ELECTROTHERM (INDIA) LIMITED,1,282,627,1184,270,60,35,5,4,0
LMV,ELECTROTHERM (INDIA) LIMITED,0,0,0,1,0,0,0,0,0,0
3W,ELEPHANTA INDUSTRIES PVT LTD,0,0,0,0,53,33,18,49,11,8
3W,ELITE AUTO ENGINEERS PVT LTD,0,55,50,85,16,75,229,509,1200,934
2W,ELTHOR ENERGY PRIVATE LIMITED,0,0,0,0,0,0,402,735,230,82
2W,EMOBI MANUFACTURY PRIVATE LIMITED,0,0,0,0,0,0,3,0,0,0
3W,ENGINIA VEHICLES PVT LTD,0,0,0,0,0,4,1,0,188,184
2W,ENGTIAN ELECTRIC BIKE PVT LTD,0,0,0,0,0,0,0,141,472,237
2W,ENIGMA AUTOMOBILES PVT LTD,0,0,0,0,0,0,0,0,2,13
3W,ENTICE IMPEX PVT LTD,0,177,200,128,101,131,148,188,587,599
3W,EPOWER VEHICLES PVT LTD,0,4,185,181,160,55,62,43,31,6
3W,ERISHA E MOBILITY PVT LTD,0,0,0,0,0,0,0,0,55,48
LMV,ERISHA E MOBILITY PVT LTD,0,0,0,0,0,0,0,0,1,1
2W,E-SPRINTO GREEN ENERGY PVT LTD,0,0,0,0,0,0,0,0,116,331
2W,ESSEL ENERGY INFRA PVT LTD,0,0,0,0,0,0,0,0,0,1
3W,ETHIRAJ AUTO UDYOG PVT LTD    ,0,0,0,1,0,0,0,0,0,0
3W,ETRIO AUTOMOBILES PVT LTD,0,0,0,0,0,0,75,179,80,6
LMV,ETRIO AUTOMOBILES PVT LTD,0,0,0,0,0,0,0,1,4,0
3W,EULER MOTORS PVT LTD,0,0,0,49,143,63,119,647,2595,2104
LMV,EULER MOTORS PVT LTD,0,0,0,0,0,0,0,7,3,2
LMV,EVAGE AUTOMOTIVE PVT LTD,0,0,0,0,0,0,0,3,44,60
3W,EVBHARAT RANGE PRIVATE LIMITED,0,0,0,0,0,0,0,15,31,18
3W,EVCO AUTOMOBILES PVT LTD,0,0,0,0,0,0,0,57,14,327
3W,EVERVE MOTORS PVT LTD,0,0,0,0,0,0,0,0,1,0
3W,EVEX AUTO INDIA PVT LTD,0,0,0,1,67,66,134,298,166,36
2W,EVTRIC MOTORS PVT LTD,0,0,0,0,0,0,0,162,540,123
2W,EXERVAL PVT LTD,0,0,0,0,0,0,0,127,83,13
3W,EXIDE INDUSTRIES LTD,0,0,0,0,1,274,519,1056,2379,1318
3W,EYUG AUTOMOBILE PVT LTD,0,0,0,0,0,0,0,0,0,10
3W,FEDE INDUSTRIES PVT LTD,0,0,0,0,0,0,0,395,900,496
2W,FIADO INDUSTRIES PVT LTD,0,0,0,0,0,0,0,5,106,58
3W,FIRST CHOICE ELECTRIC VEHICLES PVT LTD,0,0,0,0,0,0,0,268,546,281
3W,FITWEL MOBILITY PVT LTD,0,0,0,0,0,0,1,31,17,2
3W,FORD INDIA PVT LTD,0,0,0,1,0,0,0,0,0,0
LMV,FORD INDIA PVT LTD,1,0,0,1,0,0,0,0,0,0
3W,FRN MOTORS PVT LTD,0,0,0,0,0,0,0,0,0,6
2W,FSTMOTO INTERNATIONAL (IMPORTER: TEDI (INDIA)),0,0,0,0,0,0,0,0,0,2
3W,G. M. VEHICLE INDUSTRIES,0,0,0,0,0,0,0,9,3,22
3W,G.K E-VEHICLS INDUSTRIES PVT LTD,0,0,0,0,0,0,0,0,74,479
3W,GALVANIC AUTO PVT LTD,0,0,0,0,0,0,0,0,188,19
LMV,GANAPATI AGRO INDUSTRIES,1,0,0,0,0,0,0,0,0,0
2W,GAURA ELECTRIC VEHICLES PVT LTD,0,0,0,0,0,0,0,0,0,163
3W,GAURI AUTO INDIA PVT. LTD,0,0,0,0,15,7,6,10,1,0
3W,GAYAM MOTOR WORKS PRIVATE LIMITED,0,0,0,0,10,28,63,0,0,0
3W,GENERAL AGENCIES(KOLKATA) PVT LTD,0,0,0,0,9,1,0,0,0,0
2W,GENERAL MOTORS INDIA PVT LTD,3,1,0,0,0,0,0,0,0,0
3W,GENERAL MOTORS INDIA PVT LTD,0,0,1,0,0,0,0,0,0,0
LMV,GENERAL MOTORS INDIA PVT LTD,1,0,0,0,0,0,0,0,0,0
3W,GKON ELECTRIC MOTOR VEHICLES PVT LTD,0,0,207,565,472,238,392,864,711,277
LMV,GKON ELECTRIC MOTOR VEHICLES PVT LTD,0,0,0,0,1,0,0,0,0,0
2W,GO GREEN EOT (ENERGY OF THINGS) PVT LTD,0,0,0,0,0,0,9,7,11,0
3W,GOBIND INDUSTRIES PVT LTD,0,0,0,0,7,0,0,12,5,10
2W,GODAWARI ELECTRIC MOTORS PVT LTD,0,0,0,0,0,0,0,0,128,184
3W,GODAWARI ELECTRIC MOTORS PVT LTD,0,0,0,0,0,0,0,0,145,155
3W,GODAWARI TECHNO SOLUTIONS PVT LTD,0,0,0,1,93,48,55,86,74,32
3W,GOENKA ELECTRIC MOTOR VEHICLES PVT LTD,0,73,348,506,693,787,743,644,462,36
LMV,GOENKA ELECTRIC MOTOR VEHICLES PVT LTD,0,0,0,1,0,0,0,0,0,0
2W,GOGORO (IMPORTER: GOGORO INDIA PRIVATE LTD),0,0,0,0,0,0,0,0,71,0
2W,GOGORO INDIA PVT LTD,0,0,0,0,0,0,0,0,18,115
2W,GOLDENLION (IMPORTER:ELLYSIUM AUTOMOTIVES PVT LTD),0,0,0,0,0,0,0,0,1,1
3W,GOOD ENERGY INDIA,1,19,36,2,3,0,0,0,0,0
3W,GOODENERGY INDIA PVT LTD,0,97,86,5,0,0,0,0,0,0
3W,GOODWILL HI PRECISION WORKS PVT LTD,0,0,3,59,53,19,10,25,0,0
3W,GOPAL AUTO MOTORS PVT LTD,0,0,0,277,262,292,518,1054,1494,939
2W,GOREEN E-MOBILITY PVT LTD,0,0,0,0,1,94,1409,5343,3040,952
2W,GREAVES ELECTRIC MOBILITY PVT LTD,0,0,0,0,0,0,0,410,24045,18424
3W,GREAVES INDIA PVT LTD,0,0,9,0,0,0,0,0,0,0
3W,GREEN EVOLVE PVT LTD,0,0,0,0,0,0,0,69,42,172
3W,GREEN KAIKETSU AUTOMOTIVE INDIA PVT LTD,0,37,146,140,146,27,14,5,0,0
3W,GREEN SHUTTLE TECHNOLOGY PVT LTD,0,0,0,0,18,14,39,36,28,27
3W,GREEN WHEELZ (INDIA),0,0,31,131,15,3,0,0,0,0
3W,GREEN WORLD MOTORS PVT LTD,0,0,0,10,2,0,0,0,0,0
3W,GREENETICS INDUSTRIES PVT LTD,0,0,1,0,0,0,0,0,116,0
3W,GREENFIT INDUSTRIES LLP,0,0,0,0,0,0,0,0,4,168
3W,GREENWHEELS AUTOMOBILE PVT LTD,0,61,170,98,201,129,505,905,872,424
3W,GRG SMART VEHICLE PVT LTD,0,0,0,0,4,29,4,0,0,0
3W,GRINDIA G MOTORS PVT LTD,0,0,0,0,0,0,0,0,3,2
3W,GURJEET AGRO INDUSTRIES,0,1,8,2,0,0,0,0,0,0
3W,GURUKIRPA INDUSTRIES,0,0,127,251,383,79,53,57,37,1
3W,HAARISH AUTOMOTIVES (OPC) PRIVATE LIMITED,0,0,0,77,105,3,2,12,11,0
3W,HAITEK AUTOMOTIVE PVT LTD,0,0,0,0,0,0,0,0,0,60
3W,HARJAS AGRO INDUSTRIES,0,0,1,0,0,0,0,0,0,0
3W,HARSHVIE INDUSTRIES PVT LTD,0,0,0,0,0,0,0,0,2,4
2W,HAYASA E-MOBILITY (INDIA) PVT LTD,0,0,0,0,0,0,0,0,4,0
3W,HBSS E MOBILITY PVT LTD,0,0,0,0,0,0,0,0,8,16
3W,H-D MOTOR COMPANY INDIA PVT LTD,0,0,4,0,0,0,0,0,0,0
2W,HERO ECO VEHICLES PVT LTD,33,22,17,17,8,0,0,0,0,0
3W,HERO ECO VEHICLES PVT LTD,0,10,1,0,0,0,0,0,0,0
2W,HERO ELECTRIC VEHICLE PVT LTD,254,246,164,616,664,593,3058,2538,0,0
3W,HERO ELECTRIC VEHICLE PVT LTD,63,94,42,5,0,0,0,0,0,0
LMV,HERO ELECTRIC VEHICLE PVT LTD,0,0,1,0,0,0,0,0,0,0
3W,HIND AGRO INDUSTRIES,0,0,0,1,0,0,0,0,0,0
3W,HITECH INDUSTRIES,0,37,62,3,0,0,0,0,0,0
3W,HI-TECH INDUSTRIES,0,0,253,257,131,37,441,297,122,21
2W,HOMFEEL VEGH AUTOMOBILES PVT LTD,0,0,0,0,0,0,0,0,6,4
2W,HONDA CARS INDIA LTD,134,81,120,4,0,0,0,0,0,0
LMV,HONDA CARS INDIA LTD,2,1,0,1,0,0,0,0,0,0
2W,HONDA MOTORCYCLE AND SCOOTER INDIA (P) LTD,119,195,36,19,4,0,0,30,0,0
LMV,HONDA MOTORCYCLE AND SCOOTER INDIA (P) LTD,0,2,0,0,0,0,0,0,0,0
2W,HOOGHLY MOTORS PVT LTD,0,0,1,0,0,0,0,0,0,0
3W,HOOGHLY MOTORS PVT LTD,0,0,918,1216,1855,689,1091,2599,3741,2783
2W,HOP ELECTRIC MOBILITY PVT LTD,0,0,0,0,0,0,0,2,209,163
3W,HOP MOTORS PVT LTD,0,0,0,0,20,15,69,217,785,340
3W,HOTAGE INDIA,0,5,688,1168,856,470,1046,4397,12840,7423
3W,HOVEL CYLINDER PVT LTD,0,152,456,676,238,30,13,21,62,48
2W,HSU DRAGON (IMPORTER: DARK FIGHT POWER PVT LTD),0,0,0,0,0,0,0,0,2,1
3W,HUNDA EV PVT LTD,0,0,0,0,0,0,0,0,125,255
3W,HUNDAL INDUSTRIES,0,0,0,256,616,292,399,848,1011,562
3W,HYKON INDIA LTD,0,0,0,0,0,0,159,306,91,17
3W,HYUNDAI MOTOR INDIA LTD,0,1,0,0,0,0,0,0,0,0
LMV,HYUNDAI MOTOR INDIA LTD,0,5,2,1,233,206,165,619,1606,757
3W,IDEAL JAWA INDIA PVT LTD,0,0,1,0,0,0,0,0,0,0
3W,INDIA SAFE ENTERPRISE,0,0,0,0,0,0,0,16,276,241
2W,INDIA YAMAHA MOTOR PVT LTD,26,31,14,2,0,0,0,0,0,0
3W,INDIA YAMAHA MOTOR PVT LTD,0,0,36,7,0,0,0,0,0,0
3W,INDIAN MOTORS,0,0,0,5,52,106,350,1114,2035,1399
2W,INDUS ELECTROTHERM INDIA LTD,13,3,2,0,0,0,0,0,0,0
3W,INS AUTOMOBILES PVT LTD,0,0,0,0,0,0,0,0,0,272
3W,INVVIGORS INDIA,0,0,0,0,0,0,0,9,96,73
2W,IRA EDUTECH PVT LTD,0,0,0,0,0,38,78,98,19,6
3W,ISUKII GREENS PVT LTD,0,0,0,0,0,0,0,0,65,14
2W,ISUZU MOTOR INDIA PVT LTD,1,0,0,0,0,0,0,0,0,0
2W,IVOOMI INNOVATION PVT LTD,0,0,0,0,0,0,0,627,2154,668
3W,J S AGRO INDUSTRIES,0,0,0,1,1,0,0,0,0,0
3W,J S MOBILEON PVT LTD,0,248,43,0,10,0,0,6,7,0
3W,J.S.AUTO PVT LTD (KANPUR),0,0,2,3,1,0,0,0,0,0
3W,JAGUAR LAND ROVER INDIA LIMITED,0,0,43,6,0,0,0,0,0,0
LMV,JAGUAR LAND ROVER INDIA LIMITED,0,0,0,0,0,0,27,40,9,4
3W,JAI SRI RAM ELECTRIC VEHICLE MANUFACTURING PVT LTD,0,0,0,0,0,0,0,0,165,108
3W,JAIDKA POWER SYSTEMS PVT LTD,0,0,0,157,414,249,180,636,163,61
LMV,JAIDKA POWER SYSTEMS PVT LTD,0,0,0,0,0,0,0,1,0,0
3W,JAISIK BUSINESS LINKS PVT LTD,0,0,0,0,0,0,176,224,600,287
3W,JAISWAL INDUSTRIES,0,0,8,0,0,0,0,0,0,0
3W,JAJODIA COMMODITIES PVT LTD,0,0,131,779,633,660,224,396,950,770
3W,JAYA AUTOMOTIVES PVT LTD      ,0,3,23,0,0,0,0,0,0,0
LMV,JAYEM AUTOMOTIVES PVT LTD,0,0,0,0,19,42,49,0,0,0
3W,JCB INDIA LTD,0,0,37,9,0,0,0,0,0,0
2W,JEEVAA E-BIKE MFG PVT LTD,0,0,0,0,0,0,0,0,0,1
3W,JEMCO ENGINEERING PVT LTD,0,0,0,3,0,0,0,0,0,0
3W,JESSUN TECHNO PVT LTD,0,0,0,174,362,43,84,155,208,101
2W,JIANGSU DALONG (IMPORTER: RILOX EV PVT LTD),0,0,0,0,0,0,0,0,2,0
2W,JIANGSU DALONG JIANHAO (IMPORTER: GREEN INDIA),0,0,0,0,0,0,0,0,1,0
3W,JIJO ELECTRIC WHEELS PVT LTD,0,137,442,471,184,6,0,0,0,0
3W,JMT VEHICLES PVT LTD,0,0,0,0,0,0,0,0,1077,1383
LMV,JOHN DEERE INDIA  PVT LTD(TRACTOR DEVISION),0,1,3,2,0,0,0,0,0,0
3W,JS MOBILEON PVT LTD,0,0,146,283,208,43,115,306,950,678
2W,JUNENG MOTORCYCLE (IMPORTER: JHEV MOTORS PVT LTD),0,0,0,0,0,0,0,0,0,52
3W,JUNO CASTINGS PVT LTD,0,9,79,238,79,6,0,0,0,0
LMV,JUNO CASTINGS PVT LTD,0,0,0,1,0,0,0,0,0,0
3W,K. S. INDUSTRIES,0,0,0,0,0,0,0,0,0,8
3W,K. V. INDUSTRIES,0,0,0,0,26,19,10,12,38,19
3W,KADESEETLA AASHIRWAD GP INDUSTRIES PVT LTD,0,0,0,0,0,0,0,0,8,4
2W,KAINING (HONGKONG) (IMPORTER: VOLTA EV PVT LTD),0,0,0,0,0,0,0,0,0,3
3W,KAKKAR ELECTRIC AUTO PVT LTD,0,0,0,0,0,0,0,0,0,93
3W,KALIKA VAHAN PVT LTD,0,0,0,55,55,39,17,2,2,0
3W,KALINGA VENTURES INDIA PVT LTD,0,0,20,96,250,96,31,110,139,9
LMV,KALINGA VENTURES INDIA PVT LTD,0,0,1,58,7,0,0,0,0,0
3W,KAMAZ INDUSTRIES,0,0,0,6,5,30,9,61,122,42
3W,KANIFA AUTOMOTIVE PVT LTD,0,0,0,0,2,78,1,0,0,0
3W,KAPTECH INDIA PVT LTD,0,0,0,205,657,357,888,1433,1846,1242
3W,KARTAR AGRO ENGINEERS PVT LTD,0,0,0,1,0,0,0,0,0,0
3W,KARTAR AGRO INDUSTRIES PVT LTD,0,0,1,0,0,0,0,0,0,0
3W,KCAS ELECTRIC VEHICLES PVT LTD,0,0,0,0,0,0,0,47,197,105
3W,KELVINATOR INDIA LTD          ,0,0,3,1,0,0,0,0,0,0
3W,KETO MOTORS PVT LTD,0,0,0,0,0,0,190,130,224,364
LMV,KETO MOTORS PVT LTD,0,0,0,0,0,0,1,0,0,0
3W,KETRON ELECTRIC VEHICLES PVT LTD,0,0,0,0,0,0,0,0,0,1
3W,KGN INDUSTRIES,0,0,0,0,16,8,0,47,405,522
LMV,KGN INDUSTRIES,0,0,0,1,0,0,0,0,0,0
3W,KHALSA  AGRO INDUSTRIES,0,0,429,11,0,21,7,31,3,0
3W,KHALSA E-VEHICLES PVT LTD,0,0,129,1299,1233,607,1214,3712,8478,5591
3W,KHEMRAJ AUTOMOTIVE INDUSTRIES,0,48,352,177,46,13,7,2,0,0
LMV,KIA INDIA PRIVATE LIMITED,0,0,0,0,0,0,0,215,438,172
LMV,KION INDIA PVT LTD,2,3,4,0,0,0,0,4,0,0
MMV,KION INDIA PVT LTD,0,2,0,0,0,0,0,0,0,0
LMV,KISAN AGRO INDUSTRIES,2,1,0,0,0,0,0,0,0,0
2W,KLB KOMAKI PVT LTD,0,0,0,0,0,0,1175,3487,4173,1889
3W,KLB KOMAKI PVT LTD,0,0,0,77,80,47,34,9,4,192
LMV,KLB KOMAKI PVT LTD,0,0,0,0,0,0,0,0,0,1
3W,KNIGHT QUEEN INDUSTRIES PV LTD,8,15,1,0,0,0,0,0,0,0
3W,KNIGHT QUEEN INDUSTRIES PVT LTD,0,3,10,4,0,0,0,0,0,0
3W,KPT INDUSTRIES LTD,0,0,0,14,3,3,4,9,11,3
3W,KRISHNA INDUSTRIES,0,0,1,0,28,39,37,41,5,0
2W,KRT MOTORS PVT LTD,1,0,0,0,0,0,0,0,0,0
LMV,KUBOTA AGRICULTURAL MACHINERY INDIA PVT.LTD.,1,0,0,0,0,0,0,0,0,0
3W,KUMAR MOTORS PVT LTD,0,1,3,0,0,0,0,0,0,0
3W,L & T CASE EQUIPMENT PVT LTD,0,0,1,0,0,0,0,0,0,0
LMV,LAKSHMI AGRO INDUSTRIES,6,1,1,0,0,0,0,0,0,0
3W,LAUNCHER MATERIAL HANDLING INDUSTRIES,0,0,0,2,2,0,0,0,0,0
2W,LECTRIX EV PVT LTD,0,0,0,0,0,0,0,2350,6203,2661
3W,LECTRIX EV PVT LTD,0,0,0,0,0,7,876,4646,7288,3785
LMV,LECTRIX EV PVT LTD,0,0,0,0,0,0,0,0,4,1
3W,LEOPAN MOTORS PRIVATE LIMITED,0,0,0,0,0,0,0,0,13,4
2W,LI-IONS ELEKTRIK SOLUTIONS PVT LTD,0,0,0,0,0,40,5,0,5,0
3W,LIONIZE AUTOMOBILE PVT LTD,0,0,0,0,0,0,0,0,0,194
LMV,LIUGONG INDIA PVT. LTD,0,0,0,0,1,0,0,9,0,0
MMV,LIUGONG INDIA PVT. LTD,0,0,0,1,0,0,0,0,0,0
2W,LOG 9 MATERIALS SCIENTIFIC PVT LTD,0,0,0,0,0,0,21,0,0,0
2W,LOHIA AUTO INDUSTRIES,0,0,1,0,0,0,0,0,0,0
3W,LOHIA AUTO INDUSTRIES,5,133,184,666,714,377,511,1523,1644,770
LMV,LOHIA AUTO INDUSTRIES,0,0,0,5,0,0,0,0,0,0
3W,LOHIA AUTO INDUSTRIES LTD.,0,400,420,165,94,54,30,185,20,0
3W,LORDS VEHICLE MFG PVT LTD,0,0,0,0,0,3,65,114,186,50
3W,LUCKY INDUSTRIES,0,0,0,0,0,0,0,0,38,88
3W,M G INDUSTRIES,0,0,0,11,65,41,5,64,145,53
LMV,M G INDUSTRIES,0,0,0,0,1,0,0,0,0,0
3W,M/S HOVEL CYLINDER PVT LTD,0,84,420,45,0,0,0,0,0,0
LMV,M/S HOVEL CYLINDER PVT LTD,0,0,11,1,0,0,0,0,0,0
3W,M/S SHRIRAM AUTO TECH PVT LTD,0,626,2227,2250,1614,692,787,2205,3637,1852
LMV,M/S SHRIRAM AUTO TECH PVT LTD,0,0,1,18,1,0,0,0,0,0
3W,M/S TRISHIKA INDUSTRIES,0,0,0,0,0,0,3,0,0,0
2W,M2GO ELECTRIC VEHICLE PVT LTD,0,0,0,0,0,19,38,4,2,0
3W,M2J E VAHAN PVT LTD,0,0,0,0,17,54,105,50,0,8
3W,MAA DURGA ELECTRIC MOTOR VEHICLE PVT LTD,0,0,0,0,0,0,0,0,0,11
3W,MAA SHAKTI EXIM PVT LTD,23,982,1196,2033,1988,881,1804,2865,2571,1373
LMV,MAA SHAKTI EXIM PVT LTD,0,0,0,1,0,0,0,0,0,0
3W,MAC AUTO INDIA,0,0,147,431,537,248,289,469,564,401
LMV,MAC AUTO INDIA,0,0,0,1,0,0,0,0,0,0
2W,MAC INTERNATIONAL (IMPORTER: JHEV MOTORS PVT LTD),0,0,0,0,0,0,0,0,1,27
LMV,MAHALINGA ENGG. INDUSTRIES  ,3,0,0,0,0,0,0,0,0,0
3W,MALAK TECHNO PVT LTD,0,0,0,0,0,0,0,0,52,50
3W,MALHOTRA  VEHICLE MANUFACTURING PVT LTD,0,0,35,47,6,0,0,0,0,0
3W,MALI ENTERPRISES PVT LTD,0,0,0,107,499,103,84,133,10,2
3W,MAN TRUCKS INDIA PVT. LTD.,0,0,14,0,0,0,0,0,0,0
3W,MANIRAM ELECTRIC VEHICLE PVT LTD,0,0,0,16,52,19,0,0,299,766
3W,MANISH EV INTERNATIONAL PRIVATE LIMITED,0,0,0,0,0,0,28,173,433,195
3W,MARINE NAVAIDS & SOLAR AUTO PVT LTD,0,0,0,0,0,4,2,14,4,0
2W,MARUTHISAN PVT LTD,0,0,0,0,0,0,0,84,147,90
LMV,MARUTI SUZUKI INDIA LTD,8,11,8,2,1,0,0,0,0,0
2W,MAULIRAJ INDUSTRIES LLP,0,0,0,0,0,0,0,0,1,1
LMV,MERCEDES-BENZ INDIA PVT LTD,0,0,0,0,0,0,0,94,193,112
3W,MG MOTOR INDIA PVT LTD,0,0,1,0,0,0,0,0,0,0
LMV,MG MOTOR INDIA PVT LTD,0,0,0,0,7,772,2384,3430,9520,7229
2W,MICROCON I2I PVT LTD,0,0,0,0,0,0,94,0,0,0
2W,MIRAKLE 5 AUTOMOBILES PVT LTD,0,0,0,0,0,0,0,18,102,12
3W,MOTOR & GENERAL SALES PVT LTD,0,0,0,102,33,1,0,0,0,0
LMV,MOTOR & GENERAL SALES PVT LTD,0,0,0,0,1,0,0,0,0,0
LMV,MOTOROYALE KINETIC PRIVATE LIMITED,0,0,0,0,0,0,0,8,0,0
2W,MOTOVOLT MOBILITY PVT LTD,0,0,0,0,0,0,0,0,0,14
3W,MOTRAC MOTORS PVT LTD,0,0,0,128,132,100,111,23,0,0
3W,MOVE STONE SERVICES PVT LTD,0,0,0,0,0,0,0,825,2965,2297
LMV,MSI INDUSTRIES,2,0,0,0,0,0,0,0,0,0
3W,MVM MOTORS PRIVATE LIMITED,0,0,0,0,0,0,0,1,0,5
3W,NABH MOTORS PVT LTD,0,29,79,86,48,6,5,12,0,0
3W,NAMAH INDUSTRIES PVT LTD,0,0,0,6,91,38,9,4,5,153
3W,NAND ELECTRIC MOTOR VEHICLE PVT LTD,0,0,6,13,30,0,0,0,3,0
3W,NANYA AIRCONN PVT LTD,0,0,14,7,1,0,0,0,0,0
3W,NB TURNED  COMPONENTS PVT LTD,0,0,31,29,13,0,2,0,0,0
LMV,NB TURNED  COMPONENTS PVT LTD,0,0,0,1,0,0,0,0,0,0
3W,NBC ENGINEERING PVT LTD,0,0,0,0,0,0,0,4,0,0
2W,NDS ECO MOTORS PVT LTD,0,0,0,48,648,146,96,28,7,2
3W,NEEDLE EYE PLASTIC INDUSTRIES PVT LTD,0,42,516,573,267,148,354,542,667,357
LMV,NEEDLE EYE PLASTIC INDUSTRIES PVT LTD,0,10,17,5,0,0,0,0,0,0
3W,NEW ARCANA INDIA,9,125,224,361,732,316,602,1331,1253,502
3W,NEW CHAWLA INDUSTRIES,0,0,0,0,0,0,0,0,0,67
3W,NEWTON INDIA INDUSTRIES PVT LTD,0,0,0,0,0,0,12,9,5,0
2W,NEXZU MOBILITY PVT LTD,0,0,0,0,370,96,16,0,0,0
3W,NEXZU MOBILITY PVT LTD,0,0,0,1,0,0,0,0,0,0
3W,NGAGE IMPEX PVT LTD,0,0,0,0,0,0,1,0,0,0
3W,NGAGE WHEEL PVT LTD,0,0,0,0,38,21,7,8,40,10
3W,NIBE MOTORS PVT LTD,0,0,0,0,15,4,1,19,19,0
3W,NICOLAS INDUSTRIES,0,0,1,0,0,0,0,0,0,0
3W,NIPUN SANYANTRA PVT LTD,0,0,0,1,17,11,290,569,439,138
3W,NIRMAL UTILITY SERVICES PVT LTD,0,0,2,128,158,48,43,77,22,7
2W,NISIKI TECHNOLOGIES PVT LTD,0,0,0,0,0,0,12,167,164,23
3W,NISSAN MOTOR INDIA PVT LTD,0,408,2,0,0,0,0,0,0,0
LMV,NISSAN MOTOR INDIA PVT LTD,0,2,4,0,1,0,0,3,0,0
3W,NRJ ELECTRIC MOTOR VEHICLES PVT LTD,0,0,0,102,468,295,760,1563,2650,2110
2W,NUMEROS MOTORS PVT LTD,0,0,0,0,0,0,0,335,473,150
2W,OBEN ELECTRIC VEHICLES PVT LTD,0,0,0,0,0,0,0,0,50,217
3W,OCULUS AUTO INDUSTRIES LLP,0,0,0,0,0,0,0,0,2,3
2W,ODYSSE ELECTRIC VEHICLES PVT LTD,0,0,0,0,0,4,81,313,210,39
3W,OGATA MOTORS INDIA PVT LTD,0,0,0,0,87,207,168,160,157,47
3W,OK PLAY INDIA LTD,0,9,336,468,130,64,6,63,125,81
LMV,OK PLAY INDIA LTD,0,0,0,0,7,0,0,0,0,0
2W,OKAYA EV PVT LTD,0,0,0,0,0,0,0,8913,15816,4387
2W,OKINAWA AUTOTECH PVT LTD,0,1,331,8452,11850,5754,30659,103620,31616,3893
3W,OKINAWA AUTOTECH PVT LTD,0,0,0,0,0,3,0,0,1,0
LMV,OKINAWA AUTOTECH PVT LTD,0,0,0,1,1,0,0,0,0,0
2W,OLA ELECTRIC TECHNOLOGIES PVT LTD,0,0,0,0,0,0,240,109398,267355,211273
3W,OLYMPUS INDUSTRIES PVT LTD,0,0,0,3,51,5,10,0,0,0
MMV,OLYMPUS INDUSTRIES PVT LTD,0,0,0,1,0,0,0,0,0,0
2W,OM BALAJEE AUTOMOBILE ( INDIA) PVT. LTD,0,0,0,0,0,0,1,0,0,0
3W,OM BALAJEE AUTOMOBILE ( INDIA) PVT. LTD,0,389,1079,1701,1610,672,1448,2930,3304,1461
3W,OM INDUSTRIES,0,0,0,35,12,1,0,0,44,768
3W,OM. INDUSTRIES,0,0,0,0,5,3,4,1,0,0
3W,OMEGA SALES & AGRO INDUSTRIES,0,0,0,0,0,3,12,102,283,188
3W,OMEGA SEIKI PVT LTD,0,0,0,0,0,0,317,2785,3579,4592
LMV,OMEGA SEIKI PVT LTD,0,0,0,0,0,0,32,146,102,61
2W,ORIGINAL FUEL SYSTEM PVT LTD,0,0,0,1,0,0,0,0,0,0
3W,ORIGINAL FUEL SYSTEM PVT LTD,0,0,15,22,0,0,0,0,0,0
2W,OZOTEC AUTOMOBILE PRIVATE LIMITED,0,0,0,0,0,0,0,93,351,56
3W,PAARTH SARTHI AUTOMOTIVE ENGINEERS PVT LTD,0,0,4,19,13,2,21,23,11,0
3W,PACE AGRO PRIVATE LIMITED,0,0,11,138,234,115,66,46,41,11
LMV,PACE AGRO PRIVATE LIMITED,0,0,0,1,0,0,0,0,0,0
3W,PACE AGRO PVT LTD,0,0,29,44,3,0,0,0,0,0
3W,PAL DIESAL PVT LTD,0,0,1,0,0,0,0,0,0,0
3W,PANSEN ENGINEERING INDIA PVT LTD,0,0,0,0,41,57,47,0,0,0
3W,PARAS INDUSTRIES,0,0,1,0,0,6,317,1120,3246,1822
LMV,PARAS INDUSTRIES,0,0,0,0,0,0,0,0,1,0
3W,PASHUPATI NATH MOTORS PVT LTD,0,0,1,14,12,2,0,0,0,0
